{
  "schema_version": 1,
  "message_type": "verification.requested",
  "message_id": "55555555-5555-4555-8555-555555555555",
  "job_id": "66666666-6666-4666-8666-666666666666",
  "attempt": 0,
  "issuance_id": null,
  "verification_id": "77777777-7777-4777-8777-777777777777",
  "input_object_key": "acceptance-corpus/v1/clean-multi-page-mixed.pdf",
  "input_sha256": "a5b701a4fded59b4f00ea46af993a3fd428ce0602135aeb27472bc59dc3910f1",
  "deadline_at": "2026-09-01T00:05:00Z",
  "correlation_id": "88888888-8888-4888-8888-888888888888"
}
